{
  "$schema": "https://json-schema.org/draft/2020-12/schema",
  "$id": "https://wellall.health/schemas/lab-report/v0.1.0",
  "title": "WellAll Lab Report",
  "description": "生化检验报告结构化 Schema，参考 LOINC 与 UCUM 作为编码与单位体系。",
  "type": "object",
  "required": ["id", "patientId", "issuedAt", "results"],
  "properties": {
    "id": { "type": "string" },
    "patientId": { "type": "string", "description": "关联健康档案 Person.id" },
    "issuedAt": { "type": "string", "format": "date-time" },
    "facility": {
      "type": "object",
      "properties": {
        "id": { "type": "string" },
        "name": { "type": "string" }
      }
    },
    "panel": { "$ref": "https://wellall.health/schemas/common/v0.1.0#/$defs/CodeableConcept" },
    "specimen": {
      "type": "object",
      "properties": {
        "type": { "$ref": "https://wellall.health/schemas/common/v0.1.0#/$defs/SpecimenType" },
        "collectedAt": { "type": "string", "format": "date-time" }
      }
    },
    "results": {
      "type": "array",
      "minItems": 1,
      "items": { "$ref": "#/$defs/LabResult" }
    }
  },
  "$defs": {
    "LabResult": {
      "type": "object",
      "required": ["code", "value"],
      "properties": {
        "code": { "$ref": "https://wellall.health/schemas/common/v0.1.0#/$defs/CodeableConcept", "description": "LOINC 指标代码。" },
        "value": {
          "description": "检验结果值：支持数值(Quantity)、定性(字符串)、或编码值(CodeableConcept)。",
          "oneOf": [
            { "$ref": "https://wellall.health/schemas/common/v0.1.0#/$defs/Quantity" },
            { "$ref": "https://wellall.health/schemas/common/v0.1.0#/$defs/CodeableConcept" },
            { "type": "string", "minLength": 1 }
          ]
        },
        "referenceRange": { "$ref": "https://wellall.health/schemas/common/v0.1.0#/$defs/ReferenceRange" },
        "interpretation": {
          "type": "string",
          "enum": ["N", "L", "H", "A"],
          "description": "N 正常，L 偏低，H 偏高，A 异常。"
        },
        "method": { "$ref": "https://wellall.health/schemas/common/v0.1.0#/$defs/CodeableConcept" }
      }
    }
  }
}
