{
  "id": "lab-2024-002",
  "patientId": "person-001",
  "issuedAt": "2024-12-03T08:40:00Z",
  "facility": { "id": "lab-01", "name": "WellAll Central Lab" },
  "panel": {
    "coding": [ { "system": "http://loinc.org", "code": "24331-1", "display": "Lipid panel" } ],
    "text": "血脂四项"
  },
  "specimen": {
    "type": { "system": "http://terminology.hl7.org/CodeSystem/v2-0487", "code": "SER", "display": "Serum" },
    "collectedAt": "2024-12-03T08:10:00Z"
  },
  "results": [
    {
      "code": { "coding": [ { "system": "http://loinc.org", "code": "2093-3", "display": "Cholesterol [Mass/volume] in Serum or Plasma" } ] },
      "value": { "value": 190, "unit": "mg/dL" },
      "referenceRange": { "low": { "value": 0, "unit": "mg/dL" }, "high": { "value": 200, "unit": "mg/dL" } },
      "interpretation": "N"
    },
    {
      "code": { "coding": [ { "system": "http://loinc.org", "code": "2085-9", "display": "Cholesterol in HDL [Mass/volume] in Serum or Plasma" } ] },
      "value": { "value": 48, "unit": "mg/dL" },
      "interpretation": "N"
    },
    {
      "code": { "coding": [ { "system": "http://loinc.org", "code": "13457-7", "display": "Cholesterol in LDL [Mass/volume] in Serum or Plasma by calculation" } ] },
      "value": { "value": 118, "unit": "mg/dL" },
      "interpretation": "N"
    },
    {
      "code": { "coding": [ { "system": "http://loinc.org", "code": "2571-8", "display": "Triglyceride [Mass/volume] in Serum or Plasma" } ] },
      "value": { "value": 140, "unit": "mg/dL" },
      "interpretation": "N"
    }
  ]
}
