{
  "id": "lab-2024-008",
  "patientId": "person-001",
  "issuedAt": "2024-12-10T08:20:00Z",
  "facility": { "id": "lab-03", "name": "WellAll Oncology Lab" },
  "specimen": {
    "type": { "system": "http://terminology.hl7.org/CodeSystem/v2-0487", "code": "SER", "display": "Serum" },
    "collectedAt": "2024-12-10T07:55:00Z"
  },
  "results": [
    {
      "code": { "coding": [ { "system": "http://loinc.org", "code": "21198-7", "display": "Choriogonadotropin.beta [Units/volume] in Serum or Plasma" } ] },
      "value": { "value": 2.0, "unit": "m[IU]/mL" },
      "interpretation": "N"
    },
    {
      "code": { "coding": [ { "system": "http://loinc.org", "code": "48138-2", "display": "Neuron specific enolase [Mass/volume] in Serum or Plasma" } ] },
      "value": { "value": 12.0, "unit": "ng/mL" },
      "interpretation": "N"
    },
    {
      "code": { "coding": [ { "system": "http://loinc.org", "code": "25390-6", "display": "Cytokeratin 19 [Mass/volume] in Serum or Plasma" } ] },
      "value": { "value": 1.8, "unit": "ng/mL" },
      "interpretation": "N"
    }
  ]
}
