{
  "id": "lab-2024-011",
  "patientId": "person-001",
  "issuedAt": "2024-12-12T08:05:00Z",
  "facility": { "id": "lab-03", "name": "WellAll Oncology Lab" },
  "specimen": {
    "type": { "system": "http://terminology.hl7.org/CodeSystem/v2-0487", "code": "SER", "display": "Serum" },
    "collectedAt": "2024-12-12T07:35:00Z"
  },
  "results": [
    {
      "code": { "coding": [ { "system": "http://loinc.org", "code": "1952-1", "display": "Beta-2-Microglobulin [Mass/volume] in Serum or Plasma" } ] },
      "value": { "value": 2.1, "unit": "mg/L" },
      "interpretation": "N"
    }
  ]
}
