{
  "id": "lab-2024-015",
  "patientId": "person-001",
  "issuedAt": "2024-12-13T10:00:00Z",
  "facility": { "id": "lab-03", "name": "WellAll Immunology Lab" },
  "specimen": {
    "type": { "system": "http://terminology.hl7.org/CodeSystem/v2-0487", "code": "SER", "display": "Serum" },
    "collectedAt": "2024-12-13T09:35:00Z"
  },
  "results": [
    {
      "code": { "coding": [ { "system": "http://loinc.org", "code": "74521-6", "display": "Complement CH50 actual/normal in Serum or Plasma by Immune assay" } ] },
      "value": { "value": 92, "unit": "%" },
      "interpretation": "N"
    },
    {
      "code": { "coding": [ { "system": "http://loinc.org", "code": "74520-8", "display": "Complement AH50 actual/normal in Serum or Plasma by Immune assay" } ] },
      "value": { "value": 97, "unit": "%" },
      "interpretation": "N"
    },
    {
      "code": { "coding": [ { "system": "http://loinc.org", "code": "74522-4", "display": "Complement lectin actual/normal in Serum or Plasma by Immune assay" } ] },
      "value": { "value": 101, "unit": "%" },
      "interpretation": "N"
    }
  ]
}
