{
  "id": "lab-2024-006",
  "patientId": "person-001",
  "issuedAt": "2024-12-08T08:15:00Z",
  "facility": { "id": "lab-03", "name": "WellAll Oncology Lab" },
  "specimen": {
    "type": { "system": "http://terminology.hl7.org/CodeSystem/v2-0487", "code": "SER", "display": "Serum" },
    "collectedAt": "2024-12-08T07:55:00Z"
  },
  "results": [
    {
      "code": { "coding": [ { "system": "http://loinc.org", "code": "2857-1", "display": "Prostate specific Ag [Mass/volume] in Serum or Plasma" } ] },
      "value": { "value": 1.1, "unit": "ng/mL" },
      "interpretation": "N"
    },
    {
      "code": { "coding": [ { "system": "http://loinc.org", "code": "2039-6", "display": "Carcinoembryonic Ag [Mass/volume] in Serum or Plasma" } ] },
      "value": { "value": 2.3, "unit": "ng/mL" },
      "interpretation": "N"
    },
    {
      "code": { "coding": [ { "system": "http://loinc.org", "code": "1834-1", "display": "Alpha-1-Fetoprotein [Mass/volume] in Serum or Plasma" } ] },
      "value": { "value": 4.8, "unit": "ng/mL" },
      "interpretation": "N"
    },
    {
      "code": { "coding": [ { "system": "http://loinc.org", "code": "10334-1", "display": "Cancer Ag 125 [Units/volume] in Serum or Plasma" } ] },
      "value": { "value": 12.0, "unit": "U/mL" },
      "interpretation": "N"
    },
    {
      "code": { "coding": [ { "system": "http://loinc.org", "code": "24108-3", "display": "Cancer Ag 19-9 [Units/volume] in Serum or Plasma" } ] },
      "value": { "value": 9.5, "unit": "U/mL" },
      "interpretation": "N"
    },
    {
      "code": { "coding": [ { "system": "http://loinc.org", "code": "6875-9", "display": "Cancer Ag 15-3 [Units/volume] in Serum or Plasma" } ] },
      "value": { "value": 18.2, "unit": "U/mL" },
      "interpretation": "N"
    }
  ]
}
