{
  "id": "lab-2024-007",
  "patientId": "person-001",
  "issuedAt": "2024-12-09T08:00:00Z",
  "facility": { "id": "lab-02", "name": "WellAll Immunology Lab" },
  "specimen": {
    "type": { "system": "http://terminology.hl7.org/CodeSystem/v2-0487", "code": "SER", "display": "Serum" },
    "collectedAt": "2024-12-09T07:30:00Z"
  },
  "results": [
    {
      "code": { "coding": [ { "system": "http://loinc.org", "code": "40655-3", "display": "Nuclear Ab [Titer] in Serum by Immunoassay" } ] },
      "value": { "value": 160, "unit": "{titer}" },
      "interpretation": "H"
    },
    {
      "code": { "coding": [ { "system": "http://loinc.org", "code": "11013-0", "display": "DNA double strand Ab [Titer] in Serum" } ] },
      "value": { "value": 80, "unit": "{titer}" },
      "interpretation": "N"
    },
    {
      "code": { "coding": [ { "system": "http://loinc.org", "code": "4485-9", "display": "Complement C3 [Mass/volume] in Serum or Plasma" } ] },
      "value": { "value": 112, "unit": "mg/dL" },
      "referenceRange": { "low": { "value": 90, "unit": "mg/dL" }, "high": { "value": 180, "unit": "mg/dL" } },
      "interpretation": "N"
    },
    {
      "code": { "coding": [ { "system": "http://loinc.org", "code": "4498-2", "display": "Complement C4 [Mass/volume] in Serum or Plasma" } ] },
      "value": { "value": 22, "unit": "mg/dL" },
      "referenceRange": { "low": { "value": 10, "unit": "mg/dL" }, "high": { "value": 40, "unit": "mg/dL" } },
      "interpretation": "N"
    }
  ]
}
