{
  "id": "lab-2024-004",
  "patientId": "person-001",
  "issuedAt": "2024-12-06T09:10:00Z",
  "facility": { "id": "lab-02", "name": "WellAll Immunology Lab" },
  "specimen": {
    "type": { "system": "http://terminology.hl7.org/CodeSystem/v2-0487", "code": "SER", "display": "Serum" },
    "collectedAt": "2024-12-06T08:40:00Z"
  },
  "results": [
    {
      "code": { "coding": [ { "system": "http://loinc.org", "code": "1988-5", "display": "C reactive protein [Mass/volume] in Serum or Plasma" } ] },
      "value": { "value": 2.1, "unit": "mg/L" },
      "interpretation": "N"
    },
    {
      "code": { "coding": [ { "system": "http://loinc.org", "code": "30522-7", "display": "C reactive protein [Mass/volume] in Serum or Plasma by High sensitivity method" } ] },
      "value": { "value": 1.6, "unit": "mg/L" },
      "interpretation": "N"
    },
    {
      "code": { "coding": [ { "system": "http://loinc.org", "code": "4537-7", "display": "Erythrocyte sedimentation rate [Rate] in Blood" } ] },
      "value": { "value": 8, "unit": "mm/h" },
      "interpretation": "N"
    },
    {
      "code": { "coding": [ { "system": "http://loinc.org", "code": "19113-0", "display": "Immunoglobulin E [Units/volume] in Serum or Plasma" } ] },
      "value": { "value": 85, "unit": "kU/L" },
      "interpretation": "N"
    }
  ]
}
