{
  "id": "lab-2024-014",
  "patientId": "person-001",
  "issuedAt": "2024-12-13T09:20:00Z",
  "facility": { "id": "lab-02", "name": "WellAll Immunology Lab" },
  "specimen": {
    "type": { "system": "http://terminology.hl7.org/CodeSystem/v2-0487", "code": "SER", "display": "Serum" },
    "collectedAt": "2024-12-13T08:50:00Z"
  },
  "results": [
    {
      "code": { "coding": [ { "system": "http://loinc.org", "code": "32677-7", "display": "DNA double strand Ab [Units/volume] in Serum by Immunoassay" } ] },
      "value": { "value": 10, "unit": "IU/mL" },
      "interpretation": "N"
    },
    {
      "code": { "coding": [ { "system": "http://loinc.org", "code": "6457-6", "display": "DNA double strand Ab [Presence] in Serum by Crithidia luciliae IF" } ] },
      "value": {
        "coding": [ { "system": "http://snomed.info/sct", "code": "260385009", "display": "Negative" } ]
      },
      "interpretation": "N"
    },
    {
      "code": { "coding": [ { "system": "http://loinc.org", "code": "81716-3", "display": "DNA double strand Ab [Presence] in Serum or Plasma by Line blot" } ] },
      "value": {
        "coding": [ { "system": "http://snomed.info/sct", "code": "260385009", "display": "Negative" } ]
      },
      "interpretation": "N"
    },
    {
      "code": { "coding": [ { "system": "http://loinc.org", "code": "11013-0", "display": "DNA double strand Ab [Titer] in Serum" } ] },
      "value": { "value": 40, "unit": "{titer}" },
      "interpretation": "A"
    }
  ]
}
