{
  "id": "lab-2024-001",
  "patientId": "person-001",
  "issuedAt": "2024-11-02T09:30:00Z",
  "facility": { "id": "lab-01", "name": "WellAll Central Lab" },
  "panel": {
    "coding": [ { "system": "http://loinc.org", "code": "24323-8", "display": "CBC panel" } ],
    "text": "全血细胞计数"
  },
  "specimen": {
    "type": { "system": "http://terminology.hl7.org/CodeSystem/v2-0487", "code": "BLD", "display": "Whole blood" },
    "collectedAt": "2024-11-02T08:55:00Z"
  },
  "results": [
    {
      "code": { "coding": [ { "system": "http://loinc.org", "code": "718-7", "display": "Hemoglobin" } ] },
      "value": { "value": 13.8, "unit": "g/dL" },
      "referenceRange": { "low": { "value": 13.5, "unit": "g/dL" }, "high": { "value": 17.5, "unit": "g/dL" } },
      "interpretation": "N"
    },
    {
      "code": { "coding": [ { "system": "http://loinc.org", "code": "4548-4", "display": "Hemoglobin A1c/Hemoglobin.total in Blood" } ] },
      "value": { "value": 6.8, "unit": "%" },
      "referenceRange": { "low": { "value": 4.0, "unit": "%" }, "high": { "value": 6.0, "unit": "%" } },
      "interpretation": "H"
    }
  ]
}
