{
  "id": "lab-2024-012",
  "patientId": "person-001",
  "issuedAt": "2024-12-12T09:00:00Z",
  "facility": { "id": "lab-03", "name": "WellAll Oncology Lab" },
  "specimen": {
    "type": { "system": "http://terminology.hl7.org/CodeSystem/v2-0487", "code": "SER", "display": "Serum" },
    "collectedAt": "2024-12-12T08:30:00Z"
  },
  "results": [
    {
      "code": { "coding": [ { "system": "http://loinc.org", "code": "25390-6", "display": "Cytokeratin 19 fragment [Mass/volume] in Serum or Plasma" } ] },
      "value": { "value": 2.1, "unit": "ng/mL" },
      "method": { "coding": [ { "system": "urn:wellall:lab-method", "code": "ECLIA", "display": "Electrochemiluminescence immunoassay" } ] },
      "interpretation": "N"
    },
    {
      "code": { "coding": [ { "system": "http://loinc.org", "code": "25390-6", "display": "Cytokeratin 19 fragment [Mass/volume] in Serum or Plasma" } ] },
      "value": { "value": 2.0, "unit": "ng/mL" },
      "method": { "coding": [ { "system": "urn:wellall:lab-method", "code": "CLIA", "display": "Chemiluminescent immunoassay" } ] },
      "interpretation": "N"
    }
  ]
}
